{
  "schema": "sigil.claim/v2",
  "claim_id": "39379936-333a-4d1f-84ff-17c5b67e9123",
  "nonce": "3382768077068078082860993590368233418991027366963353883235971145467820282553",
  "registration_sha256": "574eb4e8fa4e679b23a4f6efa4e7590697b71778627fa3a5980ce37badb0b830",
  "suspect_model_sha256": "c3e94aff7dd74fc2865ce607336d15c42a0c93fef778f9c2cac309be23ae3ac6",
  "opened_at": "2026-10-04T22:23:11.566Z"
}